{
  "task_id": "task_db_001",
  "requester_identity": {
    "type": "user",
    "id": "engineer_17"
  },
  "target_agent": "dbread-agent-v1",
  "intent": "Fetch active incident summary for the payments service",
  "constraints": {
    "common": {
      "environment": "staging",
      "limit": 5,
      "redaction_level": "basic"
    },
    "domain": {
      "query_type": "aggregate",
      "dataset": "incident_metrics",
      "service": "payments"
    }
  },
  "risk_class": "medium",
  "deadline": "2026-03-19T18:00:00Z",
  "delegation_token": "signed-token-ref",
  "requested_output_mode": "summary"
}
