{
  "task_id": "task_123",
  "parent_task_id": "task_root_001",
  "requester_identity": {
    "type": "user",
    "id": "user_42"
  },
  "target_agent": "payment-agent-v1",
  "intent": "Pay approved vendor for invoice INV-223",
  "constraints": {
    "common": {
      "resource_id": "vendor_abc",
      "max_amount": 4500,
      "currency": "INR"
    },
    "domain": {
      "invoice_id": "INV-223",
      "approved_vendor_only": true
    }
  },
  "risk_class": "high",
  "deadline": "2026-03-19T18:00:00Z",
  "delegation_token": "signed-token-ref",
  "requested_output_mode": "summary",
  "metadata": {
    "source": "demo",
    "schema_version": "1.1.0"
  }
}
